Hildigrim, Longhole, Woody End, Stoor, 88, 25, Male, 51, 6
Samlad, Headstrong, Bywater, Harfoot, 63, 22, Male, 74, 4
Wilibald, Brandagamba, Woody End, Harfoot, 80, 27, Male, 51, 2
Berenger, Goldworthy, Hobbiton, Fallohide, 72, 21, Male, 72, 7
Gerontius, Gamwich, Shire, Harfoot, 87, 22, Male, 83, 7
Agobard, Gardner, Eastfarthing, Harfoot, 61, 33, Male, 40, 6
Timba, Hayward, Bywater, Harfoot, 92, 20, Male, 43, 10
Taurin, Goodbody, Westfarthing, Stoor, 95, 28, Male, 89, 9
Bladud, Roper, Eastfarthing, Stoor, 99, 27, Male, 50, 6
Alberic, Smallburrow, Tuckborough, Fallohide, 66, 31, Male, 83, 8
Balderic, Hogg, Hobbiton, Harfoot, 95, 30, Male, 83, 3
Theodard, Hlothran, Woody End, Fallohide, 99, 37, Male, 50, 1
Flavus, Hlothran, Bywater, Harfoot, 77, 36, Male, 53, 6
Sago, Burrows, Tookland, Fallohide, 77, 25, Male, 68, 2
Asselin, Greenholm, Bridgefields, Stoor, 83, 28, Male, 33, 7
Gereon, Proudfoot, Woody End, Harfoot, 83, 33, Male, 89, 10
Wulfhard, Longhole, Westmarch, Fallohide, 70, 27, Male, 53, 9
Aregisel, Twofoot, Eastfarthing, Stoor, 60, 22, Male, 64, 7
Hildebald, Headstrong, Westmarch, Stoor, 83, 29, Male, 55, 8
Besso, Hayward, Southfarthing, Stoor, 71, 39, Male, 39, 9
Benild, Gamgee, Buckland, Stoor, 83, 37, Male, 40, 4
Thietmar, Brownlock, Southfarthing, Stoor, 62, 23, Male, 42, 8
Orderic, Chubb, Marish, Stoor, 74, 25, Male, 84, 1
Fortinbras, Maggot, Green Hill, Fallohide, 97, 30, Male, 83, 1
Audovald, Galpsi, Northfarthing, Harfoot, 85, 33, Male, 87, 5
Theodon, Cotton, Tuckborough, Fallohide, 68, 37, Male, 83, 8
Nibelung, Burrows, Marish, Stoor, 73, 31, Male, 74, 9
Gundahar, Tuk, Westmarch, Harfoot, 61, 24, Male, 52, 5
Cyr, Brockhouse, Shire, Harfoot, 66, 28, Male, 34, 6
Butilin, Chubb, Shire, Fallohide, 79, 37, Male, 81, 2
Nick, Goold, Marish, Harfoot, 60, 23, Male, 89, 2
Bucca, Roper, Woody End, Fallohide, 82, 27, Male, 52, 9
Audramnus, Gamgee, Shire, Stoor, 94, 32, Male, 55, 8
Chlodomer, Twofoot, Marish, Stoor, 90, 26, Male, 88, 8
Wilcome, Goodenough, Bywater, Harfoot, 93, 34, Male, 80, 3
Berchar, Fallohide, Northfarthing, Stoor, 88, 21, Male, 34, 4
Fulrad, Rumble, Green Hill, Stoor, 97, 38, Male, 47, 10
Ilberic, Townsend, Buckland, Fallohide, 89, 29, Male, 57, 3
Merry, Pott, Tookland, Harfoot, 89, 33, Male, 35, 6
Marcoul, Rumble, Northfarthing, Stoor, 89, 36, Male, 47, 9
Cottar, Oldbuck, Bridgefields, Fallohide, 71, 27, Male, 44, 8
Theutgaud, Brandagamba, Marish, Fallohide, 76, 25, Male, 90, 7
Walaric, Stoor, Hobbiton, Fallohide, 81, 20, Male, 63, 3
Nicol, Goold, Northfarthing, Fallohide, 80, 35, Male, 86, 8
Nick, Diggle, Green Hill, Fallohide, 83, 32, Male, 36, 10
Marcus, Sandyman, Bywater, Harfoot, 67, 37, Male, 92, 7
Clotaire, Longholes, Woody End, Stoor, 86, 37, Male, 85, 2
Wandregisilus, Zaragamba, Tuckborough, Harfoot, 73, 27, Male, 62, 6
Amator, Gawkroger, Westfarthing, Stoor, 95, 22, Male, 52, 4
Crassus, Proudfoot, Southfarthing, Stoor, 90, 30, Male, 84, 9
Medard, Twofoot, Northfarthing, Fallohide, 88, 31, Male, 58, 10
Sancho, Butcher, Woody End, Harfoot, 92, 21, Male, 89, 6
Fulbert, Brown, Buckland, Stoor, 62, 31, Male, 60, 1
Gozolon, Gamgee, Hobbiton, Fallohide, 86, 27, Male, 66, 5
Gundahar, Burrow, Bridgefields, Harfoot, 74, 35, Male, 40, 1
Hubert, Townsend, Green Hill, Stoor, 86, 23, Male, 82, 6
Bilbo, Baggins, Bridgefields, Stoor, 87, 38, Male, 34, 7
Aregisel, Zaragamba, Westmarch, Harfoot, 74, 30, Male, 36, 2
Wazo, Bracegirdle, Woody End, Stoor, 92, 33, Male, 86, 3
Thierry, Gammidge, Southfarthing, Harfoot, 70, 36, Male, 84, 9
Frodo, Baggins, Westmarch, Fallohide, 90, 36, Male, 54, 9
Peregrin, Tuk, Eastfarthing, Harfoot, 68, 32, Male, 40, 7
Sam, Gamgee, Buckland, Stoor, 72, 37, Male, 90, 3
Merry, Brandybuck, Marish, Fallohide, 84, 38, Male, 83, 5
Berylla, Hlothran, Westmarch, Stoor, 68, 27, Female, 44, 5
Narcissa, Oldbuck, Hobbiton, Harfoot, 95, 34, Female, 55, 7
Amarylla, Burrow, Buckland, Fallohide, 81, 31, Female, 44, 6
Viola, Hogg, Buckland, Harfoot, 66, 33, Female, 91, 8
Camella, Twofoot, Southfarthing, Stoor, 84, 24, Female, 78, 10
Daffodila, Galbasi, Northfarthing, Fallohide, 82, 25, Female, 59, 9
Hilda, Burrows, Hobbiton, Harfoot, 96, 22, Female, 73, 2
Lalia, Harfoot, Tuckborough, Fallohide, 99, 22, Female, 91, 8
Calamintha, Noaks, Green Hill, Stoor, 95, 28, Female, 51, 3
Calaminth, Lightfoot, Green Hill, Harfoot, 77, 20, Female, 88, 4
Peony, Fallohide, Tuckborough, Harfoot, 87, 21, Female, 49, 9
Bell, Sandyman, Northfarthing, Harfoot, 99, 29, Female, 50, 1
Dahlia, Townsend, Marish, Harfoot, 70, 37, Female, 67, 1
Daffodila, Sandyman, Green Hill, Harfoot, 69, 30, Female, 70, 7
Gilly, Burrow, Tuckborough, Fallohide, 87, 28, Female, 75, 9
Dahlia, Hornblower, Eastfarthing, Stoor, 91, 39, Female, 34, 6
Cercis, Gawkroger, Bywater, Stoor, 95, 21, Female, 65, 5
Belba, Galpsi, Northfarthing, Harfoot, 98, 23, Female, 92, 5
Alchemilla, Lightfoot, Northfarthing, Fallohide, 66, 37, Female, 51, 2
Agate, Butcher, Southfarthing, Harfoot, 98, 33, Female, 65, 3
Camella, Longholes, Buckland, Stoor, 86, 23, Female, 53, 6
Anagellis, Goodenough, Bridgefields, Harfoot, 99, 32, Female, 58, 6
Jade, Noaks, Northfarthing, Fallohide, 86, 20, Female, 42, 6
Diamond, Gamgee, Eastfarthing, Fallohide, 86, 21, Female, 62, 9
Celeste, Headstrong, Tuckborough, Fallohide, 80, 34, Female, 61, 2
Lamia, Brockhouse, Green Hill, Harfoot, 88, 32, Female, 82, 10
Peona, Longholes, Northfarthing, Stoor, 65, 39, Female, 89, 2
Celeste, Sandyman, Bywater, Stoor, 75, 29, Female, 67, 9
Virginia, Marsh, Marish, Stoor, 66, 33, Female, 77, 4
Lyla, Goold, Westmarch, Stoor, 70, 20, Female, 58, 8
Amsonia, Goold, Marish, Stoor, 60, 25, Female, 51, 8
Canna, Longhole, Southfarthing, Harfoot, 91, 32, Female, 72, 9
Diamond, Proudfoot, Tuckborough, Harfoot, 70, 37, Female, 41, 2
Hildibrand, Twofoot, Bywater, Fallohide, 79, 25, Female, 57, 10
Gilly, Galpsi, Bridgefields, Harfoot, 72, 28, Female, 86, 4
Nemisa, Pott, Green Hill, Fallohide, 64, 37, Female, 85, 2
Angelona, Burrow, Westfarthing, Harfoot, 91, 34, Female, 74, 4
Hanna, Lightfoot, Westfarthing, Harfoot, 72, 34, Female, 59, 6
Belladonna, Bunce, Green Hill, Fallohide, 71, 24, Female, 58, 6
Calla, Burrows, Green Hill, Harfoot, 77, 24, Female, 55, 2
Calla, Fallohide, Southfarthing, Stoor, 90, 39, Female, 44, 8
Celosia, Longholes, Woody End, Harfoot, 69, 37, Female, 91, 4
Chica, Greenholm, Buckland, Harfoot, 97, 36, Female, 60, 7
Melilot, Sandheaver, Hobbiton, Fallohide, 67, 37, Female, 46, 4
Emerald, Underhill, Westfarthing, Fallohide, 99, 36, Female, 39, 7
Crocosmia, Oldbuck, Westfarthing, Harfoot, 89, 36, Female, 63, 6
Heather, Burrow, Southfarthing, Stoor, 98, 25, Female, 68, 9
Sapphire, Stoor, Buckland, Stoor, 63, 34, Female, 51, 10
Berylla, Longholes, Eastfarthing, Harfoot, 87, 37, Female, 37, 5
Gerbera, Whitfoot, Eastfarthing, Harfoot, 83, 20, Female, 82, 1
Camomile, Noaks, Eastfarthing, Fallohide, 87, 36, Female, 52, 6
Gaura, Longhole, Southfarthing, Stoor, 85, 37, Female, 49, 4
Camassia, Goold, Westmarch, Harfoot, 73, 23, Female, 56, 2
Lavender, Proudfoot, Buckland, Harfoot, 96, 25, Female, 81, 1
Ruby, Hayward, Bridgefields, Harfoot, 69, 36, Female, 85, 7
Petunia, Banks, Tookland, Fallohide, 89, 22, Female, 67, 5
Verbena, Sackville, Eastfarthing, Stoor, 93, 36, Female, 34, 1
Dandelion, Puddifoot, Bywater, Harfoot, 73, 24, Female, 50, 5
Peona, Gamwich, Green Hill, Harfoot, 74, 34, Female, 62, 1
Anemone, Rumble, Bridgefields, Fallohide, 82, 32, Female, 78, 4
Opal, Pott, Tuckborough, Harfoot, 61, 34, Female, 72, 2
Azalea, Tuk, Northfarthing, Harfoot, 60, 22, Female, 88, 6
Primula, Goldworthy, Buckland, Fallohide, 63, 25, Female, 39, 4
Belba, Longholes, Hobbiton, Stoor, 81, 35, Female, 57, 6
Canna, Smallburrow, Hobbiton, Stoor, 70, 38, Female, 43, 3
Malva, Tunnelly, Northfarthing, Harfoot, 93, 36, Female, 47, 3
Celeste, Gammidge, Tuckborough, Harfoot, 94, 27, Female, 63, 10
Dianthus, Lightfoot, Shire, Fallohide, 78, 35, Female, 61, 10
Monarda, Smallburrow, Bywater, Stoor, 71, 28, Female, 42, 7
Malva, Tunnelly, Westfarthing, Harfoot, 63, 21, Female, 85, 8
Brunnera, Gardner, Westfarthing, Fallohide, 80, 35, Female, 82, 6
Zinnia, Headstrong, Tookland, Harfoot, 69, 30, Female, 81, 7
Cercis, Chubb, Southfarthing, Harfoot, 78, 28, Female, 44, 6
Maple, Mugwort, Buckland, Fallohide, 77, 28, Female, 82, 10
Belladonna, Smallburrow, Northfarthing, Stoor, 69, 32, Female, 61, 3
Iris, Gammidge, Eastfarthing, Harfoot, 82, 38, Female, 71, 4
Elanor, Stoor, Tuckborough, Stoor, 83, 23, Female, 72, 4
Pimpernel, Cotton, Southfarthing, Stoor, 92, 22, Female, 81, 4
Narcissa, Greenholm, Buckland, Fallohide, 66, 39, Female, 90, 1
Adamanta, Longhole, Southfarthing, Fallohide, 97, 27, Female, 48, 9
Gazania, Meadows, Westfarthing, Stoor, 89, 38, Female, 76, 6
Dandelia, Rumble, Bywater, Harfoot, 69, 27, Female, 40, 1
Anagelli, Pott, Southfarthing, Harfoot, 88, 21, Female, 39, 10
Hilda, Whitfoot, Tuckborough, Harfoot, 71, 25, Female, 47, 7
Lyla, Roper, Shire, Stoor, 85, 24, Female, 91, 10
Beryl, Whitfoot, Bridgefields, Fallohide, 76, 26, Female, 56, 9
Calla, Goodenough, Westmarch, Fallohide, 79, 28, Female, 34, 1
Crocosmia, Greenhand, Westmarch, Stoor, 88, 27, Female, 86, 4
Camassia, Diggle, Tuckborough, Fallohide, 96, 32, Female, 77, 3
Cosma, Cotton, Woody End, Stoor, 98, 35, Female, 79, 2
Anagelli, Tunnelly, Tookland, Fallohide, 90, 26, Female, 45, 5
Belladonna, Marsh, Marish, Stoor, 95, 22, Female, 38, 8
Celosia, Pott, Green Hill, Fallohide, 87, 32, Female, 48, 4
Pimpanella, Clayhanger, Westfarthing, Fallohide, 83, 37, Female, 73, 8
Lily, Burrowes, Shire, Fallohide, 70, 23, Female, 55, 5
Brunnera, Brownlock, Southfarthing, Harfoot, 77, 24, Female, 75, 4
Belladonna, Brockhouse, Tookland, Fallohide, 68, 20, Female, 50, 7
Pearl, Hornblower, Northfarthing, Stoor, 78, 25, Female, 49, 5
Heliconia, Stoor, Northfarthing, Fallohide, 73, 24, Female, 49, 9
Celosa, Sandheaver, Tuckborough, Harfoot, 93, 20, Female, 69, 8
Diamond, Brandagamba, Eastfarthing, Fallohide, 70, 20, Female, 36, 8
Malva, Goold, Buckland, Fallohide, 83, 34, Female, 88, 10
Gaura, Underhill, Bridgefields, Harfoot, 91, 26, Female, 64, 1
Gerania, Galpsi, Tuckborough, Harfoot, 81, 25, Female, 55, 9
Veronica, Twofoot, Hobbiton, Harfoot, 82, 35, Female, 63, 7
Coryda, Roper, Marish, Fallohide, 91, 21, Female, 78, 3
Celosa, Cotton, Northfarthing, Fallohide, 65, 33, Female, 39, 2
Begona, Brockhouse, Marish, Stoor, 62, 28, Female, 84, 2
Viola, Underhill, Eastfarthing, Stoor, 99, 36, Female, 70, 6
Lotus, Townsend, Westmarch, Stoor, 65, 34, Female, 82, 9
Heliconia, Burrowes, Marish, Stoor, 81, 27, Female, 65, 8
Lily, Diggle, Bridgefields, Stoor, 73, 28, Female, 64, 10
Amarantha, Goodbody, Buckland, Fallohide, 87, 28, Female, 68, 5
Malva, Cotton, Eastfarthing, Fallohide, 97, 25, Female, 41, 4
Calceola, Gardner, Tuckborough, Fallohide, 96, 27, Female, 89, 10
Pearl, Chubb, Green Hill, Stoor, 70, 25, Female, 88, 5
Calendine, Labingi, Bridgefields, Stoor, 60, 33, Female, 60, 8
Cleome, Maggot, Westfarthing, Harfoot, 95, 36, Female, 90, 10
Heliconia, Longhole, Tuckborough, Fallohide, 72, 31, Female, 36, 2
Jasmina, Took, Bridgefields, Harfoot, 91, 34, Female, 77, 8
Diascia, Oldbuck, Bridgefields, Fallohide, 98, 38, Female, 34, 7
Holly, Goold, Westmarch, Harfoot, 78, 39, Female, 64, 6
Cleoma, Brownlock, Southfarthing, Fallohide, 64, 36, Female, 75, 10
Eglantine, Whitfoot, Eastfarthing, Harfoot, 87, 24, Female, 82, 4
Amsonia, Gardner, Marish, Stoor, 74, 34, Female, 37, 7
Lonicera, Bolger, Hobbiton, Stoor, 85, 21, Female, 33, 2
Dicentra, Bolger, Westfarthing, Fallohide, 85, 23, Female, 62, 6
Eglantine, Harfoot, Southfarthing, Stoor, 65, 27, Female, 44, 9
Chica, Labingi, Tuckborough, Stoor, 93, 33, Female, 66, 9
Narcissa, Burrow, Tookland, Harfoot, 93, 38, Female, 35, 8
Jasmina, Mugwort, Buckland, Harfoot, 90, 21, Female, 33, 7
Diascia, Longhole, Woody End, Harfoot, 87, 20, Female, 60, 9
Camellia, Burrow, Shire, Harfoot, 95, 25, Female, 39, 1
Viola, Butcher, Tookland, Stoor, 67, 33, Female, 34, 5
Daffodila, Gamwich, Bridgefields, Harfoot, 95, 39, Female, 85, 2
Malva, Hornblower, Shire, Stoor, 69, 21, Female, 44, 5
Alyssa, Puddifoot, Westfarthing, Harfoot, 90, 34, Female, 86, 1
Myrtle, Hayward, Buckland, Stoor, 79, 36, Female, 64, 5
Adaldrida, Greenhand, Bywater, Fallohide, 86, 38, Female, 74, 7
Lamia, Gardner, Eastfarthing, Stoor, 81, 24, Female, 73, 8
Peona, Gamwich, Buckland, Stoor, 78, 24, Female, 53, 10
Emerald, Hlothran, Northfarthing, Stoor, 80, 21, Female, 67, 10
Lobelia, Goodenough, Woody End, Fallohide, 88, 34, Female, 77, 8
Gilly, Cotton, Green Hill, Fallohide, 94, 23, Female, 39, 10
Elanor, Brandybuck, Bridgefields, Fallohide, 97, 23, Female, 65, 9
Tulip, Brown, Bywater, Fallohide, 87, 35, Female, 49, 8
Camomila, Maggot, Bywater, Fallohide, 86, 30, Female, 54, 10
Calla, Oldbuck, Bridgefields, Harfoot, 90, 29, Female, 72, 10
Calamintha, Greenholm, Shire, Stoor, 72, 36, Female, 48, 4
Amaryllis, Hogg, Northfarthing, Harfoot, 70, 21, Female, 71, 1
Camomila, Burrowes, Westmarch, Stoor, 70, 34, Female, 42, 4
Melilot, Goodenough, Bywater, Stoor, 61, 28, Female, 58, 9
Primula, Banks, Marish, Stoor, 91, 30, Female, 67, 3
Lamia, Longhole, Buckland, Fallohide, 79, 22, Female, 51, 10
Veronica, Puddifoot, Woody End, Harfoot, 68, 33, Female, 65, 7
Gardenia, Goldworthy, Bywater, Stoor, 64, 31, Female, 51, 4
Chica, Gardner, Northfarthing, Stoor, 76, 21, Female, 91, 9
Poinsetta, Gawkroger, Bridgefields, Harfoot, 79, 31, Female, 65, 9
Laura, Labingi, Westfarthing, Fallohide, 88, 34, Female, 68, 4
Forsythia, Whitfoot, Westfarthing, Fallohide, 64, 21, Female, 59, 10
Gladiola, Meadows, Green Hill, Harfoot, 79, 35, Female, 50, 9
Forsythia, Fairbairn, Tuckborough, Harfoot, 66, 20, Female, 55, 4
Eranthis, Headstrong, Shire, Fallohide, 67, 34, Female, 71, 7
Begonia, Tuk, Northfarthing, Harfoot, 84, 38, Female, 72, 10
Achilla, Cotton, Tuckborough, Fallohide, 76, 27, Female, 64, 10
Diascia, Sandyman, Eastfarthing, Stoor, 73, 39, Female, 38, 3
Dianthus, Boffin, Buckland, Harfoot, 95, 32, Female, 70, 10
Hildibrand, Hayward, Southfarthing, Harfoot, 97, 25, Female, 91, 1
Lobelia, Burrow, Tuckborough, Fallohide, 96, 38, Female, 51, 1
Lantana, Smallburrow, Buckland, Fallohide, 71, 38, Female, 91, 4
Berylla, Clayhanger, Bywater, Fallohide, 71, 24, Female, 85, 3
Angelica, Whitfoot, Westmarch, Fallohide, 98, 29, Female, 56, 5
Dandelion, Mugwort, Hobbiton, Harfoot, 81, 24, Female, 60, 3
Camomile, Stoor, Eastfarthing, Harfoot, 65, 28, Female, 57, 1
Cleoma, Stoor, Westfarthing, Fallohide, 98, 24, Female, 45, 8
Peona, Gawkroger, Northfarthing, Harfoot, 64, 39, Female, 62, 10
Iris, Chubb, Green Hill, Fallohide, 76, 20, Female, 61, 7
Belladonna, Took, Southfarthing, Fallohide, 84, 33, Female, 43, 1
Hildigrim, Gamwich, Hobbiton, Fallohide, 65, 27, Female, 76, 9
Myrtle, Galpsi, Westfarthing, Stoor, 97, 31, Female, 85, 2
Canna, Diggle, Westfarthing, Fallohide, 93, 32, Female, 72, 6
Achilla, Twofoot, Shire, Harfoot, 76, 24, Female, 68, 6
Lobelia, Harfoot, Bywater, Stoor, 96, 38, Female, 40, 9
Melilot, Hogg, Green Hill, Stoor, 95, 35, Female, 47, 8
Jasmina, Mugwort, Bridgefields, Harfoot, 84, 27, Female, 92, 1
Estella, Galbasi, Green Hill, Harfoot, 70, 30, Female, 79, 10
Jasmina, Marsh, Woody End, Stoor, 84, 22, Female, 49, 8
Rose, Longhole, Eastfarthing, Fallohide, 62, 22, Female, 38, 3
Pearl, Goodbody, Tuckborough, Harfoot, 64, 29, Female, 65, 2
Hanna, Mugwort, Woody End, Harfoot, 79, 36, Female, 43, 7
Mahonia, Brockhouse, Westmarch, Stoor, 86, 25, Female, 52, 5
Dora, Chubb, Westmarch, Fallohide, 96, 24, Female, 75, 1
Agate, Zaragamba, Westmarch, Harfoot, 78, 38, Female, 84, 7
Lyla, Twofoot, Bywater, Fallohide, 73, 38, Female, 78, 10
Calyca, Brownlock, Woody End, Harfoot, 87, 37, Female, 54, 1
Dahlia, Twofoot, Bywater, Fallohide, 85, 32, Female, 73, 4
Canna, Bophin, Shire, Stoor, 71, 38, Female, 70, 8
Berylla, Labingi, Westmarch, Harfoot, 94, 33, Female, 56, 9
Calaminth, Brandybuck, Eastfarthing, Stoor, 90, 30, Female, 81, 6
Rosa, Headstrong, Green Hill, Harfoot, 62, 32, Female, 39, 10
Clover, Fairbairn, Woody End, Fallohide, 71, 22, Female, 42, 5
Cercis, Whitfoot, Woody End, Fallohide, 95, 26, Female, 68, 4
Peony, Hlothran, Buckland, Fallohide, 97, 24, Female, 41, 9
Lyla, Townsend, Tuckborough, Stoor, 66, 33, Female, 42, 5
Gladiola, Gamgee, Green Hill, Fallohide, 67, 22, Female, 81, 4
Lunaria, Burrows, Northfarthing, Fallohide, 93, 31, Female, 68, 8
Viola, Sandyman, Southfarthing, Harfoot, 67, 38, Female, 74, 9
Lalia, Hlothran, Southfarthing, Stoor, 91, 23, Female, 86, 7
Garnette, Marsh, Eastfarthing, Harfoot, 80, 31, Female, 48, 1
Datura, Sandheaver, Eastfarthing, Harfoot, 77, 26, Female, 56, 6
Pimpernel, Stoor, Bywater, Stoor, 88, 27, Female, 48, 3
Anagelli, Marsh, Tuckborough, Fallohide, 69, 37, Female, 66, 6
Meadow, Noaks, Bridgefields, Fallohide, 84, 31, Female, 87, 7
Gerbera, Burrows, Shire, Fallohide, 76, 21, Female, 91, 8
Celeste, Marsh, Shire, Stoor, 73, 29, Female, 88, 10
Narcissa, Marsh, Bywater, Harfoot, 96, 34, Female, 84, 5
Verbena, Greenholm, Green Hill, Harfoot, 66, 24, Female, 75, 4
Gaura, Brandagamba, Bridgefields, Stoor, 97, 37, Female, 91, 7
Anagellis, Gawkroger, Bridgefields, Fallohide, 86, 24, Female, 71, 4
Hanna, Sandheaver, Green Hill, Stoor, 86, 28, Female, 85, 5
Catalpa, Hayward, Tookland, Stoor, 81, 35, Female, 85, 4
Clematis, Hayward, Woody End, Stoor, 82, 36, Female, 83, 4
Dandelion, Brandagamba, Bridgefields, Stoor, 99, 31, Female, 33, 8
Nemisa, Zaragamba, Eastfarthing, Stoor, 80, 24, Female, 58, 5
Liatris, Goodenough, Shire, Stoor, 80, 28, Female, 88, 8
Lavenda, Goldworthy, Tookland, Fallohide, 69, 39, Female, 46, 5
Melilot, Harfoot, Bridgefields, Stoor, 91, 39, Female, 64, 8
Liatra, Underhill, Green Hill, Fallohide, 81, 33, Female, 77, 2
Monarda, Stoor, Northfarthing, Harfoot, 60, 36, Female, 79, 4
Brodia, Bracegirdle, Shire, Harfoot, 93, 29, Female, 50, 2
Hilda, Sandyman, Southfarthing, Stoor, 87, 23, Female, 35, 2
Lavender, Underhill, Tookland, Stoor, 63, 36, Female, 47, 7
Petunia, Brockhouse, Westfarthing, Harfoot, 85, 33, Female, 75, 2
Dianthus, Clayhanger, Marish, Stoor, 67, 34, Female, 42, 3
Lobelia, Goodchild, Southfarthing, Stoor, 63, 27, Female, 67, 1
Meadow, Lightfoot, Northfarthing, Fallohide, 83, 29, Female, 77, 9
Clematis, Gamwich, Marish, Harfoot, 80, 27, Female, 60, 2
Nemisa, Gawkroger, Southfarthing, Harfoot, 75, 25, Female, 59, 10
Catalpa, Tuk, Northfarthing, Fallohide, 61, 34, Female, 67, 9
Belba, Maggot, Southfarthing, Harfoot, 86, 28, Female, 41, 4
Dianthus, Underhill, Northfarthing, Fallohide, 95, 25, Female, 57, 5
Meadow, Goldworthy, Eastfarthing, Fallohide, 98, 28, Female, 42, 10
Lysima, Bolger, Buckland, Stoor, 95, 35, Female, 86, 10
Liatra, Bolger, Woody End, Harfoot, 92, 34, Female, 44, 5
Calendine, Pott, Green Hill, Fallohide, 64, 37, Female, 90, 10
Donnamira, Brockhouse, Eastfarthing, Harfoot, 78, 35, Female, 92, 5
Garnette, Whitfoot, Bridgefields, Stoor, 97, 26, Female, 66, 1
Lila, Labingi, Tookland, Fallohide, 90, 27, Female, 41, 9
Adaldrida, Roper, Bywater, Stoor, 99, 35, Female, 43, 9
Brunnera, Burrowes, Eastfarthing, Harfoot, 61, 20, Female, 61, 9
Opal, Bolger, Eastfarthing, Fallohide, 61, 22, Female, 46, 1
Primrose, Fairbairn, Bridgefields, Harfoot, 67, 25, Female, 69, 5
Rosa, Tunnelly, Westmarch, Fallohide, 83, 31, Female, 55, 2
Opal, Goodenough, Buckland, Stoor, 93, 20, Female, 58, 3
Dandelia, Clayhanger, Bywater, Harfoot, 93, 30, Female, 45, 2
Salvia, Hayward, Tookland, Harfoot, 65, 33, Female, 79, 2
Daisy, Marsh, Eastfarthing, Harfoot, 85, 38, Female, 50, 3
Rose, Bolger, Green Hill, Stoor, 64, 29, Female, 83, 6
Heliconia, Brockhouse, Hobbiton, Fallohide, 84, 39, Female, 54, 10
Meadow, Whitfoot, Southfarthing, Stoor, 75, 30, Female, 82, 10
Lotus, Hornblower, Tuckborough, Harfoot, 85, 29, Female, 55, 9
Tulip, Rumble, Shire, Fallohide, 92, 25, Female, 85, 1
Asphodel, Pott, Eastfarthing, Harfoot, 61, 39, Female, 61, 9
Adaldrida, Goodbody, Shire, Fallohide, 64, 20, Female, 68, 4
Anagella, Brandybuck, Buckland, Stoor, 78, 22, Female, 69, 2
Pearl, Headstrong, Green Hill, Harfoot, 67, 20, Female, 78, 6
Poinsetta, Whitfoot, Tookland, Stoor, 70, 34, Female, 86, 5
Azalea, Greenhand, Westfarthing, Stoor, 94, 37, Female, 68, 2
Laura, Brockhouse, Marish, Harfoot, 79, 20, Female, 76, 1
Esmerelda, Smallburrow, Tuckborough, Stoor, 92, 30, Female, 88, 2
Monarda, Oldbuck, Green Hill, Harfoot, 95, 28, Female, 52, 10
Allia, Butcher, Hobbiton, Harfoot, 89, 24, Female, 50, 3
Adamanta, Labingi, Tuckborough, Harfoot, 87, 29, Female, 55, 6
Nigella, Pott, Tuckborough, Stoor, 69, 20, Female, 90, 4
Angelica, Zaragamba, Tookland, Fallohide, 92, 28, Female, 77, 4
Sapphire, Lightfoot, Tuckborough, Harfoot, 79, 23, Female, 78, 1
Gilly, Harfoot, Buckland, Harfoot, 91, 32, Female, 37, 2
Adamanta, Greenhand, Marish, Harfoot, 86, 27, Female, 82, 4
Lily, Gammidge, Southfarthing, Stoor, 68, 26, Female, 54, 9
Cleome, Goodbody, Southfarthing, Stoor, 78, 32, Female, 51, 2
Zinnia, Banks, Northfarthing, Stoor, 76, 39, Female, 41, 6
Begona, Harfoot, Shire, Stoor, 81, 27, Female, 90, 3
Celesta, Harfoot, Woody End, Harfoot, 60, 31, Female, 66, 4
Anagellis, Mugwort, Eastfarthing, Fallohide, 93, 20, Female, 39, 6
Cercis, Took, Tuckborough, Stoor, 71, 30, Female, 78, 9
Adamanta, Twofoot, Westfarthing, Fallohide, 60, 32, Female, 40, 6
Hyacynth, Gammidge, Woody End, Harfoot, 97, 23, Female, 86, 6
Dicentra, Boffin, Southfarthing, Harfoot, 67, 23, Female, 68, 4
Opal, Bolger, Southfarthing, Stoor, 92, 32, Female, 67, 2
Nigella, Tuk, Bywater, Stoor, 77, 32, Female, 33, 2
Peony, Stoor, Bridgefields, Harfoot, 65, 35, Female, 91, 1
Silene, Galpsi, Shire, Fallohide, 86, 32, Female, 61, 10
Gazania, Pott, Green Hill, Fallohide, 62, 26, Female, 46, 9
Amaranth, Tuk, Green Hill, Stoor, 89, 29, Female, 75, 4
Berylla, Burrowes, Hobbiton, Fallohide, 75, 29, Female, 80, 3
Valera, Banks, Green Hill, Fallohide, 72, 20, Female, 75, 8
Marigold, Took, Green Hill, Harfoot, 97, 30, Female, 59, 7
Liatra, Greenholm, Hobbiton, Stoor, 81, 24, Female, 46, 4
Calaminth, Goodbody, Tuckborough, Harfoot, 67, 30, Female, 81, 3
Angelona, Greenholm, Westfarthing, Harfoot, 67, 25, Female, 50, 3
Diascia, Tuk, Woody End, Harfoot, 70, 20, Female, 52, 1
Diamond, Butcher, Tookland, Fallohide, 83, 25, Female, 47, 3
Maple, Butcher, Hobbiton, Fallohide, 76, 36, Female, 83, 2
Camella, Banks, Northfarthing, Stoor, 86, 21, Female, 65, 2
Dora, Sandheaver, Westmarch, Stoor, 78, 33, Female, 54, 7
Pearl, Fairbairn, Northfarthing, Stoor, 65, 37, Female, 51, 10
Jasmina, Gamwich, Hobbiton, Fallohide, 61, 20, Female, 49, 4
Sapphire, Gammidge, Southfarthing, Stoor, 90, 25, Female, 73, 5
Agate, Galpsi, Bywater, Stoor, 76, 39, Female, 39, 3
Lavender, Bophin, Southfarthing, Fallohide, 88, 29, Female, 52, 4
Forsythia, Roper, Buckland, Harfoot, 87, 28, Female, 77, 2
Lalia, Proudfoot, Westmarch, Fallohide, 79, 27, Female, 67, 9
Scilla, Gamwich, Bywater, Harfoot, 68, 38, Female, 59, 9
Adaldrida, Twofoot, Bywater, Harfoot, 91, 29, Female, 57, 2
Calaminth, Butcher, Bywater, Fallohide, 73, 37, Female, 64, 8
Camomila, Chubb, Woody End, Stoor, 84, 32, Female, 92, 1
Estella, Puddifoot, Shire, Stoor, 67, 23, Female, 70, 4
Jasmina, Goldworthy, Buckland, Stoor, 88, 20, Female, 52, 5
Lavenda, Hogg, Westmarch, Harfoot, 76, 33, Female, 72, 1
Opal, Longhole, Westfarthing, Fallohide, 60, 29, Female, 40, 7
Laura, Brown, Southfarthing, Fallohide, 94, 35, Female, 38, 4
Lyla, Proudfoot, Woody End, Harfoot, 77, 35, Female, 63, 9
Pimpanella, Burrows, Shire, Stoor, 74, 23, Female, 44, 3
Hanna, Burrow, Marish, Stoor, 88, 34, Female, 69, 9
Brunnera, Brandybuck, Bywater, Harfoot, 73, 23, Female, 33, 7
Peony, Labingi, Shire, Fallohide, 97, 27, Female, 82, 1
Beryl, Baggins, Westfarthing, Fallohide, 87, 33, Female, 68, 2
Achilla, Lightfoot, Tuckborough, Harfoot, 76, 33, Female, 34, 5
Lantana, Brockhouse, Southfarthing, Stoor, 74, 28, Female, 63, 9
Anagelli, Butcher, Woody End, Stoor, 61, 36, Female, 39, 10
Alyssa, Bracegirdle, Woody End, Fallohide, 89, 39, Female, 90, 3
Amsonia, Pott, Tuckborough, Stoor, 82, 20, Female, 39, 3
Agate, Tuk, Marish, Fallohide, 90, 35, Female, 46, 1
Dora, Sackville, Buckland, Fallohide, 88, 33, Female, 89, 9
Hyacynth, Hornblower, Tuckborough, Fallohide, 96, 26, Female, 64, 3
Holly, Galbasi, Green Hill, Stoor, 97, 23, Female, 49, 1
Hildibrand, Mugwort, Shire, Harfoot, 99, 37, Female, 79, 9
Catalpa, Bolger, Bywater, Fallohide, 95, 28, Female, 38, 1
Tanta, Oldbuck, Eastfarthing, Stoor, 82, 31, Female, 63, 4
Tulip, Hogg, Tuckborough, Fallohide, 73, 21, Female, 85, 9
Primula, Harfoot, Tookland, Harfoot, 84, 25, Female, 69, 7
Primula, Banks, Westmarch, Harfoot, 98, 38, Female, 64, 10
Melilot, Bracegirdle, Tuckborough, Stoor, 73, 39, Female, 72, 1
Rose, Burrow, Eastfarthing, Harfoot, 84, 33, Female, 43, 8
Lysima, Clayhanger, Tuckborough, Stoor, 65, 20, Female, 45, 3
Peona, Cotton, Bywater, Stoor, 82, 24, Female, 38, 2
Gaura, Cotton, Northfarthing, Fallohide, 77, 23, Female, 41, 4
Angelica, Bunce, Buckland, Fallohide, 94, 29, Female, 67, 6
Nemisia, Fallohide, Shire, Fallohide, 66, 38, Female, 39, 9
Peony, Lightfoot, Eastfarthing, Stoor, 74, 28, Female, 34, 7
Meadow, Gammidge, Southfarthing, Stoor, 65, 22, Female, 61, 5
Linaria, Hornblower, Buckland, Stoor, 89, 29, Female, 62, 4
Nemisia, Twofoot, Westmarch, Harfoot, 67, 23, Female, 78, 7
Dora, Took, Green Hill, Harfoot, 74, 28, Female, 61, 8
Ruby, Longhole, Tookland, Harfoot, 80, 31, Female, 51, 5
Camella, Tuk, Southfarthing, Stoor, 83, 24, Female, 40, 8
Amsonia, Underhill, Marish, Fallohide, 93, 31, Female, 49, 10
Holly, Headstrong, Tuckborough, Harfoot, 89, 36, Female, 67, 3
Bessera, Hayward, Hobbiton, Fallohide, 60, 35, Female, 44, 4
Diascia, Greenhand, Westmarch, Fallohide, 94, 35, Female, 73, 3
Dahlia, Hlothran, Bywater, Harfoot, 75, 23, Female, 88, 8
Amaryllis, Labingi, Northfarthing, Fallohide, 91, 29, Female, 91, 3
Amaryllis, Stoor, Buckland, Fallohide, 93, 38, Female, 56, 5
Rowan, Tuk, Buckland, Stoor, 76, 26, Female, 38, 1
Peony, Burrow, Southfarthing, Fallohide, 95, 21, Female, 43, 7
