Cerasta, Boffin, Tookland, Harfoot, 61, 37, Female, 43, 6
Gladiola, Whitfoot, Green Hill, Harfoot, 77, 25, Female, 73, 6
Calla, Bracegirdle, Hobbiton, Harfoot, 95, 24, Female, 58, 8
Zinnia, Stoor, Hobbiton, Fallohide, 85, 34, Female, 47, 10
Celosia, Chubb, Hobbiton, Fallohide, 92, 33, Female, 48, 1
Estella, Goold, Green Hill, Fallohide, 84, 26, Female, 86, 8
Poppy, Greenholm, Westmarch, Fallohide, 66, 27, Female, 55, 5
Gerania, Cotton, Bywater, Fallohide, 60, 32, Female, 63, 7
Petunia, Greenhand, Hobbiton, Harfoot, 84, 38, Female, 83, 6
Celeste, Bunce, Northfarthing, Harfoot, 89, 36, Female, 64, 3
Achilla, Pott, Westfarthing, Fallohide, 89, 39, Female, 75, 8
Iris, Mugwort, Westfarthing, Harfoot, 67, 38, Female, 40, 9
Lunaria, Smallburrow, Woody End, Harfoot, 88, 30, Female, 77, 3
Cleoma, Gamwich, Woody End, Stoor, 71, 38, Female, 54, 10
Goldilocks, Pott, Northfarthing, Fallohide, 66, 27, Female, 67, 9
Achilla, Burrow, Buckland, Stoor, 90, 25, Female, 66, 3
Gardenia, Smallburrow, Westmarch, Fallohide, 78, 38, Female, 86, 2
Holly, Gawkroger, Northfarthing, Stoor, 63, 21, Female, 46, 7
Lonicera, Hayward, Woody End, Fallohide, 96, 38, Female, 89, 4
Lunaria, Bolger, Eastfarthing, Fallohide, 67, 30, Female, 88, 1
Monarda, Labingi, Eastfarthing, Harfoot, 97, 23, Female, 58, 1
Gardenia, Sackville, Eastfarthing, Fallohide, 99, 39, Female, 65, 7
Calceola, Lightfoot, Tuckborough, Fallohide, 62, 27, Female, 73, 10
Dahlia, Burrowes, Woody End, Harfoot, 60, 39, Female, 55, 2
Hyacinth, Goodenough, Buckland, Stoor, 67, 23, Female, 43, 1
Cerasta, Sandheaver, Green Hill, Harfoot, 61, 21, Female, 52, 9
Cleoma, Goodchild, Bywater, Fallohide, 68, 23, Female, 64, 6
Gazania, Bunce, Bywater, Stoor, 77, 28, Female, 34, 4
Dicentra, Mugwort, Marish, Harfoot, 96, 22, Female, 56, 2
Monarda, Hornblower, Marish, Fallohide, 85, 31, Female, 50, 10
Celosia, Rumble, Bridgefields, Harfoot, 94, 28, Female, 78, 10
Salva, Clayhanger, Shire, Stoor, 66, 30, Female, 61, 10
Gazania, Goodchild, Southfarthing, Stoor, 67, 39, Female, 52, 5
Agate, Banks, Bridgefields, Stoor, 73, 30, Female, 35, 7
Amaranth, Goodenough, Marish, Fallohide, 62, 21, Female, 62, 10
Maple, Harfoot, Shire, Stoor, 63, 22, Female, 89, 7
Anagellis, Rumble, Westmarch, Stoor, 93, 38, Female, 45, 1
Eranthis, Proudfoot, Southfarthing, Fallohide, 61, 26, Female, 90, 7
Holly, Bunce, Westfarthing, Stoor, 66, 32, Female, 65, 6
Magnolia, Maggot, Eastfarthing, Stoor, 77, 33, Female, 68, 6
Anagella, Underhill, Shire, Stoor, 95, 27, Female, 83, 6
Eglantine, Tunnelly, Westfarthing, Fallohide, 62, 33, Female, 62, 1
Esmerelda, Sackville, Northfarthing, Harfoot, 67, 25, Female, 71, 9
Celosa, Labingi, Southfarthing, Stoor, 81, 25, Female, 86, 6
Caltha, Brandybuck, Northfarthing, Stoor, 73, 27, Female, 68, 7
Primrose, Diggle, Bridgefields, Stoor, 86, 23, Female, 53, 2
Lily, Mugwort, Hobbiton, Stoor, 87, 34, Female, 40, 5
Gladiola, Maggot, Hobbiton, Stoor, 75, 36, Female, 77, 7
Nemisa, Hlothran, Tookland, Stoor, 95, 23, Female, 64, 5
Poinsetta, Fallohide, Eastfarthing, Fallohide, 90, 23, Female, 35, 9
Angelica, Goodbody, Northfarthing, Stoor, 66, 33, Female, 43, 1
Myrtle, Bophin, Bridgefields, Harfoot, 76, 23, Female, 78, 1
Mahonia, Goodbody, Westfarthing, Fallohide, 77, 32, Female, 40, 7
Lobelia, Gamwich, Tuckborough, Stoor, 95, 27, Female, 82, 4
Holly, Bracegirdle, Woody End, Fallohide, 89, 30, Female, 80, 5
Gilly, Marsh, Tuckborough, Harfoot, 67, 31, Female, 50, 1
Gerbera, Cotton, Northfarthing, Stoor, 67, 36, Female, 79, 4
Marigold, Stoor, Westfarthing, Fallohide, 74, 26, Female, 59, 1
Adamanta, Gawkroger, Green Hill, Stoor, 63, 26, Female, 47, 9
Catalpa, Galbasi, Hobbiton, Stoor, 97, 39, Female, 33, 3
Lunaria, Townsend, Westmarch, Fallohide, 71, 39, Female, 77, 5
Melilot, Brockhouse, Southfarthing, Fallohide, 85, 30, Female, 53, 8
Monarda, Pott, Green Hill, Harfoot, 75, 33, Female, 72, 8
Iris, Gamwich, Northfarthing, Stoor, 70, 23, Female, 86, 2
Amarylla, Burrowes, Southfarthing, Stoor, 92, 31, Female, 62, 9
Lantana, Clayhanger, Tookland, Stoor, 76, 37, Female, 37, 6
Pimpernel, Proudfoot, Hobbiton, Harfoot, 67, 28, Female, 49, 9
Hilda, Banks, Buckland, Harfoot, 83, 32, Female, 66, 9
Forsythia, Pott, Eastfarthing, Harfoot, 71, 21, Female, 67, 2
Corna, Pott, Green Hill, Harfoot, 75, 37, Female, 82, 10
Anagelli, Whitfoot, Marish, Stoor, 88, 29, Female, 38, 3
Gerania, Tunnelly, Green Hill, Stoor, 78, 23, Female, 48, 6
Datura, Longhole, Bridgefields, Harfoot, 67, 23, Female, 69, 9
Hilda, Goodbody, Westmarch, Harfoot, 72, 33, Female, 84, 9
Daisy, Townsend, Shire, Harfoot, 64, 26, Female, 58, 1
Marigold, Puddifoot, Green Hill, Stoor, 86, 28, Female, 43, 2
Cleome, Pott, Buckland, Fallohide, 83, 26, Female, 92, 2
Brunnera, Galbasi, Westmarch, Stoor, 88, 30, Female, 76, 6
Calaminth, Puddifoot, Woody End, Harfoot, 75, 34, Female, 35, 9
Gladiola, Marsh, Shire, Harfoot, 84, 37, Female, 49, 9
Gilly, Twofoot, Bridgefields, Stoor, 70, 30, Female, 37, 10
Rowan, Bracegirdle, Woody End, Stoor, 95, 25, Female, 42, 7
Azalea, Goodchild, Green Hill, Stoor, 98, 35, Female, 75, 1
Salva, Goodchild, Bywater, Harfoot, 64, 36, Female, 68, 4
Iris, Bracegirdle, Eastfarthing, Stoor, 64, 32, Female, 58, 4
Lantana, Brown, Bywater, Stoor, 84, 29, Female, 34, 2
Datura, Bophin, Hobbiton, Fallohide, 86, 26, Female, 39, 8
Lily, Hornblower, Marish, Harfoot, 98, 26, Female, 87, 2
Cercis, Gammidge, Buckland, Fallohide, 93, 31, Female, 75, 6
Goldilocks, Longholes, Bridgefields, Fallohide, 85, 34, Female, 66, 6
Rosa, Tunnelly, Eastfarthing, Harfoot, 86, 34, Female, 43, 3
Pearl, Tuk, Tuckborough, Stoor, 77, 31, Female, 88, 7
Asphodel, Cotton, Northfarthing, Fallohide, 89, 26, Female, 63, 8
Calceola, Gamwich, Westmarch, Fallohide, 92, 23, Female, 58, 5
Dicentra, Goldworthy, Bywater, Fallohide, 82, 28, Female, 41, 9
Gerbera, Fairbairn, Tuckborough, Fallohide, 77, 22, Female, 74, 9
Nemisia, Bracegirdle, Eastfarthing, Fallohide, 81, 34, Female, 35, 7
Alyssa, Hlothran, Marish, Harfoot, 75, 23, Female, 71, 2
Celesta, Clayhanger, Tookland, Fallohide, 62, 24, Female, 61, 10
Menegilda, Gammidge, Eastfarthing, Harfoot, 67, 34, Female, 45, 6
Hildigrim, Gammidge, Northfarthing, Harfoot, 90, 28, Female, 92, 7
Sapphire, Sandheaver, Eastfarthing, Fallohide, 66, 20, Female, 58, 5
Eranthis, Baggins, Shire, Stoor, 69, 21, Female, 50, 7
Gaura, Brownlock, Northfarthing, Stoor, 80, 38, Female, 62, 2
Diamond, Greenholm, Southfarthing, Stoor, 62, 22, Female, 60, 6
Ruellia, Goodbody, Green Hill, Harfoot, 97, 32, Female, 81, 3
Adaldrida, Labingi, Shire, Fallohide, 76, 30, Female, 92, 1
Pearl, Oldbuck, Westmarch, Stoor, 61, 25, Female, 65, 10
Bessera, Proudfoot, Bridgefields, Fallohide, 99, 28, Female, 88, 6
Mahonia, Brandybuck, Northfarthing, Fallohide, 78, 35, Female, 41, 2
Heliconia, Boffin, Tookland, Fallohide, 93, 34, Female, 82, 4
Dianthus, Brandagamba, Hobbiton, Harfoot, 60, 34, Female, 84, 7
Silene, Burrows, Tuckborough, Harfoot, 76, 22, Female, 76, 9
Crocosmia, Mugwort, Buckland, Fallohide, 79, 36, Female, 62, 6
Meadow, Noaks, Bridgefields, Harfoot, 66, 23, Female, 67, 3
Diascia, Gamwich, Shire, Fallohide, 73, 34, Female, 90, 2
Dandelia, Twofoot, Green Hill, Harfoot, 87, 21, Female, 39, 7
Alyssa, Galpsi, Buckland, Fallohide, 77, 28, Female, 59, 10
Poinsetta, Bolger, Green Hill, Stoor, 84, 27, Female, 83, 8
Pearl, Took, Tuckborough, Harfoot, 68, 23, Female, 39, 10
Gaura, Tuk, Buckland, Fallohide, 74, 27, Female, 70, 6
Melilot, Stoor, Buckland, Fallohide, 88, 31, Female, 57, 8
Dahlia, Brownlock, Northfarthing, Stoor, 64, 22, Female, 42, 1
Daffodil, Baggins, Shire, Stoor, 68, 33, Female, 83, 10
Amaryllis, Headstrong, Buckland, Fallohide, 60, 20, Female, 72, 3
Camellia, Sackville, Northfarthing, Stoor, 94, 23, Female, 85, 9
Corna, Gamwich, Bywater, Stoor, 97, 25, Female, 74, 3
Lonicera, Brownlock, Buckland, Stoor, 68, 30, Female, 78, 4
Viola, Burrow, Marish, Fallohide, 72, 20, Female, 66, 9
Lyla, Gamgee, Hobbiton, Stoor, 72, 35, Female, 49, 6
Linaria, Sackville, Bywater, Fallohide, 72, 33, Female, 79, 7
Gilly, Longhole, Buckland, Fallohide, 77, 24, Female, 49, 7
Salvia, Oldbuck, Tookland, Harfoot, 61, 30, Female, 64, 8
Celosa, Twofoot, Woody End, Fallohide, 90, 23, Female, 49, 7
Heather, Goodchild, Marish, Fallohide, 79, 26, Female, 86, 1